{
  "$ref": "#/definitions/galleries",
  "definitions": {
    "galleries": {
      "type": "object",
      "properties": {
        "title": {
          "type": "string"
        },
        "description": {
          "type": "string"
        },
        "order": {
          "type": "number"
        },
        "coverImage": {
          "type": "string"
        },
        "images": {
          "type": "array",
          "items": {
            "type": "object",
            "properties": {
              "src": {
                "type": "string"
              },
              "alt": {
                "type": "string"
              },
              "caption": {
                "type": "string"
              }
            },
            "required": [
              "src"
            ],
            "additionalProperties": false
          }
        },
        "$schema": {
          "type": "string"
        }
      },
      "required": [
        "title",
        "coverImage",
        "images"
      ],
      "additionalProperties": false
    }
  },
  "$schema": "http://json-schema.org/draft-07/schema#"
}