{
  "title": "Vaasobjecten",
  "description": "Vaasobjecten",
  "coverImage": "/images/galleries/vaasobjecten/IMG_2752.jpeg",
  "images": [
    {"src": "/images/galleries/vaasobjecten/IMG_2752.jpeg", "alt": "IMG_2752.jpeg", "caption": ""},
    {"src": "/images/galleries/vaasobjecten/IMG_2790.jpg", "alt": "IMG_2790.jpg", "caption": ""},
    {"src": "/images/galleries/vaasobjecten/IMG_2791.jpg", "alt": "IMG_2791.jpg", "caption": ""},
    {"src": "/images/galleries/vaasobjecten/IMG_2793.jpeg", "alt": "IMG_2793.jpeg", "caption": ""},
    {"src": "/images/galleries/vaasobjecten/IMG_4798.JPG", "alt": "IMG_4798.JPG", "caption": ""},
    {"src": "/images/galleries/vaasobjecten/IMG_4818.JPG", "alt": "IMG_4818.JPG", "caption": ""},
    {"src": "/images/galleries/vaasobjecten/IMG_5617.JPG", "alt": "IMG_5617.JPG", "caption": ""},
    {"src": "/images/galleries/vaasobjecten/IMG_5623.JPG", "alt": "IMG_5623.JPG", "caption": ""},
    {"src": "/images/galleries/vaasobjecten/IMG_5629.JPG", "alt": "IMG_5629.JPG", "caption": ""},
    {"src": "/images/galleries/vaasobjecten/IMG_5630.JPG", "alt": "IMG_5630.JPG", "caption": ""},
    {"src": "/images/galleries/vaasobjecten/IMG_5841.JPG", "alt": "IMG_5841.JPG", "caption": ""},
    {"src": "/images/galleries/vaasobjecten/IMG_5882.JPG", "alt": "IMG_5882.JPG", "caption": ""},
    {"src": "/images/galleries/vaasobjecten/IMG_7501.jpeg", "alt": "IMG_7501.jpeg", "caption": ""},
    {"src": "/images/galleries/vaasobjecten/IMG_7511.jpeg", "alt": "IMG_7511.jpeg", "caption": ""},
    {"src": "/images/galleries/vaasobjecten/IMG_9621 (1).jpeg", "alt": "IMG_9621 (1).jpeg", "caption": ""},
    {"src": "/images/galleries/vaasobjecten/IMG_9621.jpeg", "alt": "IMG_9621.jpeg", "caption": ""},
    {"src": "/images/galleries/vaasobjecten/P3176005.JPG", "alt": "P3176005.JPG", "caption": ""},
    {"src": "/images/galleries/vaasobjecten/PA011009.JPG", "alt": "PA011009.JPG", "caption": ""}
  ]
}
