{
  "title": "Doosobjecten",
  "description": "Doosobjecten",
  "order": 2,
  "coverImage": "/images/galleries/doosobjecten/IMG_2524.jpeg",
  "images": [
    {"src": "/images/galleries/doosobjecten/IMG_2524.jpeg", "alt": "IMG_2524.jpeg", "caption": ""},
    {"src": "/images/galleries/doosobjecten/IMG_2528.jpeg", "alt": "IMG_2528.jpeg", "caption": ""},
    {"src": "/images/galleries/doosobjecten/IMG_2548.jpg", "alt": "IMG_2548.jpg", "caption": ""},
    {"src": "/images/galleries/doosobjecten/IMG_2560.jpeg", "alt": "IMG_2560.jpeg", "caption": ""},
    {"src": "/images/galleries/doosobjecten/IMG_2572.jpeg", "alt": "IMG_2572.jpeg", "caption": ""},
    {"src": "/images/galleries/doosobjecten/IMG_2573.jpeg", "alt": "IMG_2573.jpeg", "caption": ""},
    {"src": "/images/galleries/doosobjecten/IMG_2577.jpeg", "alt": "IMG_2577.jpeg", "caption": ""},
    {"src": "/images/galleries/doosobjecten/IMG_2578.jpeg", "alt": "IMG_2578.jpeg", "caption": ""},
    {"src": "/images/galleries/doosobjecten/IMG_2589.jpeg", "alt": "IMG_2589.jpeg", "caption": ""},
    {"src": "/images/galleries/doosobjecten/IMG_2596.jpg", "alt": "IMG_2596.jpg", "caption": ""},
    {"src": "/images/galleries/doosobjecten/IMG_4323.JPG", "alt": "IMG_4323.JPG", "caption": ""},
    {"src": "/images/galleries/doosobjecten/IMG_4326.JPG", "alt": "IMG_4326.JPG", "caption": ""},
    {"src": "/images/galleries/doosobjecten/IMG_4544.JPG", "alt": "IMG_4544.JPG", "caption": ""},
    {"src": "/images/galleries/doosobjecten/IMG_5565.JPG", "alt": "IMG_5565.JPG", "caption": ""},
    {"src": "/images/galleries/doosobjecten/IMG_5615.JPG", "alt": "IMG_5615.JPG", "caption": ""},
    {"src": "/images/galleries/doosobjecten/IMG_5868.JPG", "alt": "IMG_5868.JPG", "caption": ""},
    {"src": "/images/galleries/doosobjecten/P1190956.jpg", "alt": "P1190956.jpg", "caption": ""},
    {"src": "/images/galleries/doosobjecten/P1230327.jpg", "alt": "P1230327.jpg", "caption": ""},
    {"src": "/images/galleries/doosobjecten/P6051183.jpg", "alt": "P6051183.jpg", "caption": ""},
    {"src": "/images/galleries/doosobjecten/P8140867.JPG", "alt": "P8140867.JPG", "caption": ""}
  ]
}